=== Collatz Closure Constant C Analysis ===
Testing formula: C = 4^k - 3^k - Σ[3^(k-p_i) * 2^(2p_i-i-1)]
Alpha = 0.415040776400857


Analyzing k=3 (n1_max=1, critical_n1=1)
  n1=1: min_C=2.100000e+01, C/4^k=0.328125, (C-3^k)/4^k=-0.093750 (checked 3 configs)
    Critical analysis: d=5.000218e+00, C/d=4.199817e+00
  n1=1: min_C=2.100000e+01, C/4^k=0.328125, (C-3^k)/4^k=-0.093750 (checked 3 configs)

Analyzing k=4 (n1_max=1, critical_n1=1)
  n1=1: min_C=1.110000e+02, C/4^k=0.433594, (C-3^k)/4^k=0.117188 (checked 4 configs)
    Critical analysis: d=4.700116e+01, C/d=2.361644e+00
  n1=1: min_C=1.110000e+02, C/4^k=0.433594, (C-3^k)/4^k=0.117188 (checked 4 configs)

Analyzing k=5 (n1_max=2, critical_n1=2)
  n1=1: min_C=5.250000e+02, C/4^k=0.512695, (C-3^k)/4^k=0.275391 (checked 5 configs)
  n1=2: min_C=4.610000e+02, C/4^k=0.450195, (C-3^k)/4^k=0.212891 (checked 10 configs)
    Critical analysis: d=1.300291e+01, C/d=3.545361e+01
  n1=2: min_C=4.610000e+02, C/4^k=0.450195, (C-3^k)/4^k=0.212891 (checked 10 configs)

Analyzing k=6 (n1_max=2, critical_n1=2)
  n1=1: min_C=2.343000e+03, C/4^k=0.572021, (C-3^k)/4^k=0.394043 (checked 6 configs)
  n1=2: min_C=2.087000e+03, C/4^k=0.509521, (C-3^k)/4^k=0.331543 (checked 15 configs)
    Critical analysis: d=2.950140e+02, C/d=7.074242e+00
  n1=2: min_C=2.087000e+03, C/4^k=0.509521, (C-3^k)/4^k=0.331543 (checked 15 configs)

Analyzing k=7 (n1_max=2, critical_n1=2)
  n1=1: min_C=1.010100e+04, C/4^k=0.616516, (C-3^k)/4^k=0.483032 (checked 7 configs)
  n1=2: min_C=9.077000e+03, C/4^k=0.554016, (C-3^k)/4^k=0.420532 (checked 21 configs)
    Critical analysis: d=1.909065e+03, C/d=4.754683e+00
  n1=2: min_C=9.077000e+03, C/4^k=0.554016, (C-3^k)/4^k=0.420532 (checked 21 configs)

Analyzing k=8 (n1_max=3, critical_n1=3)
  n1=1: min_C=4.259100e+04, C/4^k=0.649887, (C-3^k)/4^k=0.549774 (checked 8 configs)
  n1=2: min_C=3.849500e+04, C/4^k=0.587387, (C-3^k)/4^k=0.487274 (checked 28 configs)
  n1=3: min_C=3.951900e+04, C/4^k=0.603012, (C-3^k)/4^k=0.502899 (checked 56 configs)
    Critical analysis: d=1.631149e+03, C/d=2.422771e+01
  n1=3: min_C=3.951900e+04, C/4^k=0.603012, (C-3^k)/4^k=0.502899 (checked 56 configs)

Analyzing k=9 (n1_max=3, critical_n1=3)
  n1=1: min_C=1.769250e+05, C/4^k=0.674915, (C-3^k)/4^k=0.599831 (checked 9 configs)
  n1=2: min_C=1.605410e+05, C/4^k=0.612415, (C-3^k)/4^k=0.537331 (checked 36 configs)
  n1=3: min_C=1.646370e+05, C/4^k=0.628040, (C-3^k)/4^k=0.552956 (checked 84 configs)
    Critical analysis: d=1.308567e+04, C/d=1.258147e+01
  n1=3: min_C=1.646370e+05, C/4^k=0.628040, (C-3^k)/4^k=0.552956 (checked 84 configs)

Analyzing k=10 (n1_max=4, critical_n1=4)
  n1=1: min_C=7.273830e+05, C/4^k=0.693686, (C-3^k)/4^k=0.637373 (checked 10 configs)
  n1=2: min_C=6.618470e+05, C/4^k=0.631186, (C-3^k)/4^k=0.574873 (checked 45 configs)
  n1=3: min_C=6.782310e+05, C/4^k=0.646811, (C-3^k)/4^k=0.590498 (checked 120 configs)
  n1=4: min_C=7.232870e+05, C/4^k=0.689780, (C-3^k)/4^k=0.633467 (checked 210 configs)
    Critical analysis: d=6.488489e+03, C/d=1.114723e+02
  n1=4: min_C=7.232870e+05, C/4^k=0.689780, (C-3^k)/4^k=0.633467 (checked 210 configs)

Analyzing k=11 (n1_max=4, critical_n1=4)
  n1=1: min_C=2.968581e+06, C/4^k=0.707765, (C-3^k)/4^k=0.665530 (checked 11 configs)
  n1=2: min_C=2.706437e+06, C/4^k=0.645265, (C-3^k)/4^k=0.603030 (checked 55 configs)
  n1=3: min_C=2.771973e+06, C/4^k=0.660890, (C-3^k)/4^k=0.618655 (checked 165 configs)
  n1=4: min_C=2.952197e+06, C/4^k=0.703859, (C-3^k)/4^k=0.661623 (checked 330 configs)
    Critical analysis: d=8.500355e+04, C/d=3.473028e+01
  n1=4: min_C=2.952197e+06, C/4^k=0.703859, (C-3^k)/4^k=0.661623 (checked 330 configs)

Analyzing k=12 (n1_max=4, critical_n1=4)
  n1=1: min_C=1.205147e+07, C/4^k=0.718324, (C-3^k)/4^k=0.686647 (checked 12 configs)
  n1=2: min_C=1.100290e+07, C/4^k=0.655824, (C-3^k)/4^k=0.624147 (checked 66 configs)
  n1=3: min_C=1.126504e+07, C/4^k=0.671449, (C-3^k)/4^k=0.639772 (checked 220 configs)
  n1=4: min_C=1.198594e+07, C/4^k=0.714417, (C-3^k)/4^k=0.682741 (checked 495 configs)
    Critical analysis: d=5.171636e+05, C/d=2.317629e+01
  n1=4: min_C=1.198594e+07, C/4^k=0.714417, (C-3^k)/4^k=0.682741 (checked 495 configs)

Analyzing k=13 (n1_max=5, critical_n1=5)
  n1=1: min_C=4.873732e+07, C/4^k=0.726243, (C-3^k)/4^k=0.702485 (checked 13 configs)
  n1=2: min_C=4.454302e+07, C/4^k=0.663743, (C-3^k)/4^k=0.639985 (checked 78 configs)
  n1=3: min_C=4.559160e+07, C/4^k=0.679368, (C-3^k)/4^k=0.655610 (checked 286 configs)
  n1=4: min_C=4.847518e+07, C/4^k=0.722336, (C-3^k)/4^k=0.698579 (checked 715 configs)
  n1=5: min_C=5.168644e+07, C/4^k=0.770188, (C-3^k)/4^k=0.746431 (checked 1287 configs)
    Critical analysis: d=5.028909e+05, C/d=1.027786e+02
  n1=5: min_C=5.168644e+07, C/4^k=0.770188, (C-3^k)/4^k=0.746431 (checked 1287 configs)

Analyzing k=14 (n1_max=5, critical_n1=5)
  n1=1: min_C=1.965436e+08, C/4^k=0.732182, (C-3^k)/4^k=0.714364 (checked 14 configs)
  n1=2: min_C=1.797664e+08, C/4^k=0.669682, (C-3^k)/4^k=0.651864 (checked 91 configs)
  n1=3: min_C=1.839607e+08, C/4^k=0.685307, (C-3^k)/4^k=0.667489 (checked 364 configs)
  n1=4: min_C=1.954950e+08, C/4^k=0.728276, (C-3^k)/4^k=0.710458 (checked 1001 configs)
  n1=5: min_C=2.083401e+08, C/4^k=0.776127, (C-3^k)/4^k=0.758309 (checked 2002 configs)
    Critical analysis: d=3.605906e+06, C/d=5.777747e+01
  n1=5: min_C=2.083401e+08, C/4^k=0.776127, (C-3^k)/4^k=0.758309 (checked 2002 configs)

Analyzing k=15 (n1_max=6, critical_n1=6)
  n1=1: min_C=7.909575e+08, C/4^k=0.736637, (C-3^k)/4^k=0.723273 (checked 15 configs)
  n1=2: min_C=7.238486e+08, C/4^k=0.674137, (C-3^k)/4^k=0.660773 (checked 105 configs)
  n1=3: min_C=7.406258e+08, C/4^k=0.689762, (C-3^k)/4^k=0.676398 (checked 455 configs)
  n1=4: min_C=7.867632e+08, C/4^k=0.732730, (C-3^k)/4^k=0.719367 (checked 1365 configs)
  n1=5: min_C=8.381434e+08, C/4^k=0.780582, (C-3^k)/4^k=0.767218 (checked 3003 configs)
  n1=6: min_C=8.850672e+08, C/4^k=0.824283, (C-3^k)/4^k=0.810920 (checked 5005 configs)
    Critical analysis: d=2.428881e+06, C/d=3.643930e+02
  n1=6: min_C=8.850672e+08, C/4^k=0.824283, (C-3^k)/4^k=0.810920 (checked 5005 configs)

Analyzing k=16 (n1_max=6, critical_n1=6)
  n1=1: min_C=3.178179e+09, C/4^k=0.739977, (C-3^k)/4^k=0.729955 (checked 16 configs)
  n1=2: min_C=2.909743e+09, C/4^k=0.677477, (C-3^k)/4^k=0.667455 (checked 120 configs)
  n1=3: min_C=2.976852e+09, C/4^k=0.693102, (C-3^k)/4^k=0.683080 (checked 560 configs)
  n1=4: min_C=3.161402e+09, C/4^k=0.736071, (C-3^k)/4^k=0.726049 (checked 1820 configs)
  n1=5: min_C=3.366922e+09, C/4^k=0.783923, (C-3^k)/4^k=0.773900 (checked 4368 configs)
  n1=6: min_C=3.554618e+09, C/4^k=0.827624, (C-3^k)/4^k=0.817601 (checked 8008 configs)
    Critical analysis: d=2.406458e+07, C/d=1.477116e+02
  n1=6: min_C=3.554618e+09, C/4^k=0.827624, (C-3^k)/4^k=0.817601 (checked 8008 configs)

Analyzing k=17 (n1_max=7, critical_n1=7)
  n1=1: min_C=1.275576e+10, C/4^k=0.742483, (C-3^k)/4^k=0.734966 (checked 17 configs)
  n1=2: min_C=1.168202e+10, C/4^k=0.679983, (C-3^k)/4^k=0.672466 (checked 136 configs)
  n1=3: min_C=1.195046e+10, C/4^k=0.695608, (C-3^k)/4^k=0.688091 (checked 680 configs)
  n1=4: min_C=1.268865e+10, C/4^k=0.738577, (C-3^k)/4^k=0.731060 (checked 2380 configs)
  n1=5: min_C=1.351074e+10, C/4^k=0.786428, (C-3^k)/4^k=0.778911 (checked 6188 configs)
  n1=6: min_C=1.426152e+10, C/4^k=0.830130, (C-3^k)/4^k=0.822613 (checked 12376 configs)
  n1=7: min_C=1.489171e+10, C/4^k=0.866812, (C-3^k)/4^k=0.859295 (checked 19448 configs)
    Critical analysis: d=5.082748e+06, C/d=2.929854e+03
  n1=7: min_C=1.489171e+10, C/4^k=0.866812, (C-3^k)/4^k=0.859295 (checked 19448 configs)

Analyzing k=18 (n1_max=7, critical_n1=7)
  n1=1: min_C=5.115219e+10, C/4^k=0.744362, (C-3^k)/4^k=0.738725 (checked 18 configs)
  n1=2: min_C=4.685722e+10, C/4^k=0.681862, (C-3^k)/4^k=0.676225 (checked 153 configs)
  n1=3: min_C=4.793096e+10, C/4^k=0.697487, (C-3^k)/4^k=0.691850 (checked 816 configs)
  n1=4: min_C=5.088375e+10, C/4^k=0.740456, (C-3^k)/4^k=0.734818 (checked 3060 configs)
  n1=5: min_C=5.417209e+10, C/4^k=0.788308, (C-3^k)/4^k=0.782670 (checked 8568 configs)
  n1=6: min_C=5.717521e+10, C/4^k=0.832009, (C-3^k)/4^k=0.826371 (checked 18564 configs)
  n1=7: min_C=5.969598e+10, C/4^k=0.868691, (C-3^k)/4^k=0.863053 (checked 31824 configs)
    Critical analysis: d=1.494724e+08, C/d=3.993780e+02
  n1=7: min_C=5.969598e+10, C/4^k=0.868691, (C-3^k)/4^k=0.863053 (checked 31824 configs)

Analyzing k=19 (n1_max=7, critical_n1=7)
  n1=1: min_C=2.049962e+11, C/4^k=0.745772, (C-3^k)/4^k=0.741543 (checked 19 configs)
  n1=2: min_C=1.878163e+11, C/4^k=0.683272, (C-3^k)/4^k=0.679043 (checked 171 configs)
  n1=3: min_C=1.921113e+11, C/4^k=0.698897, (C-3^k)/4^k=0.694668 (checked 969 configs)
  n1=4: min_C=2.039224e+11, C/4^k=0.741865, (C-3^k)/4^k=0.737637 (checked 3876 configs)
  n1=5: min_C=2.170758e+11, C/4^k=0.789717, (C-3^k)/4^k=0.785489 (checked 11628 configs)
  n1=6: min_C=2.290883e+11, C/4^k=0.833418, (C-3^k)/4^k=0.829190 (checked 27132 configs)
  n1=7: min_C=2.391714e+11, C/4^k=0.870100, (C-3^k)/4^k=0.865872 (checked 50388 configs)
    Critical analysis: d=9.853149e+08, C/d=2.427360e+02
  n1=7: min_C=2.391714e+11, C/4^k=0.870100, (C-3^k)/4^k=0.865872 (checked 50388 configs)

Analyzing k=20 (n1_max=8, critical_n1=8)
  n1=1: min_C=8.211469e+11, C/4^k=0.746829, (C-3^k)/4^k=0.743658 (checked 20 configs)
  n1=2: min_C=7.524275e+11, C/4^k=0.684329, (C-3^k)/4^k=0.681158 (checked 190 configs)
  n1=3: min_C=7.696073e+11, C/4^k=0.699954, (C-3^k)/4^k=0.696783 (checked 1140 configs)
  n1=4: min_C=8.168520e+11, C/4^k=0.742923, (C-3^k)/4^k=0.739751 (checked 4845 configs)
  n1=5: min_C=8.694653e+11, C/4^k=0.790774, (C-3^k)/4^k=0.787603 (checked 15504 configs)
  n1=7: min_C=9.578477e+11, C/4^k=0.871157, (C-3^k)/4^k=0.867986 (checked 77520 configs)
  n1=8: min_C=9.902445e+11, C/4^k=0.900622, (C-3^k)/4^k=0.897451 (checked 125970 configs)
    Critical analysis: d=8.083780e+08, C/d=1.224977e+03
  n1=8: min_C=9.902445e+11, C/4^k=0.900622, (C-3^k)/4^k=0.897451 (checked 125970 configs)

Analyzing k=21 (n1_max=8, critical_n1=8)
  n1=1: min_C=3.288075e+12, C/4^k=0.747622, (C-3^k)/4^k=0.745243 (checked 21 configs)
  n1=2: min_C=3.013197e+12, C/4^k=0.685122, (C-3^k)/4^k=0.682743 (checked 210 configs)
  n1=3: min_C=3.081916e+12, C/4^k=0.700747, (C-3^k)/4^k=0.698368 (checked 1330 configs)
  n1=4: min_C=3.270895e+12, C/4^k=0.743715, (C-3^k)/4^k=0.741337 (checked 5985 configs)
  n1=5: min_C=3.481348e+12, C/4^k=0.791567, (C-3^k)/4^k=0.789188 (checked 20349 configs)
  n1=7: min_C=3.834878e+12, C/4^k=0.871950, (C-3^k)/4^k=0.869572 (checked 116280 configs)
  n1=8: min_C=3.964465e+12, C/4^k=0.901415, (C-3^k)/4^k=0.899037 (checked 203490 configs)
    Critical analysis: d=6.720336e+09, C/d=5.899207e+02
  n1=8: min_C=3.964465e+12, C/4^k=0.901415, (C-3^k)/4^k=0.899037 (checked 203490 configs)

Analyzing k=22 (n1_max=9, critical_n1=9)
  n1=1: min_C=1.316276e+13, C/4^k=0.748216, (C-3^k)/4^k=0.746432 (checked 22 configs)
  n1=2: min_C=1.206325e+13, C/4^k=0.685716, (C-3^k)/4^k=0.683932 (checked 231 configs)
  n1=3: min_C=1.233812e+13, C/4^k=0.701341, (C-3^k)/4^k=0.699557 (checked 1540 configs)
  n1=4: min_C=1.309404e+13, C/4^k=0.744310, (C-3^k)/4^k=0.742526 (checked 7315 configs)
  n1=5: min_C=1.393585e+13, C/4^k=0.792162, (C-3^k)/4^k=0.790378 (checked 26334 configs)
  n1=8: min_C=1.586832e+13, C/4^k=0.902010, (C-3^k)/4^k=0.900226 (checked 319770 configs)
  n1=9: min_C=1.627426e+13, C/4^k=0.925085, (C-3^k)/4^k=0.923301 (checked 497420 configs)
    Critical analysis: d=2.980396e+09, C/d=5.460436e+03
  n1=9: min_C=1.627426e+13, C/4^k=0.925085, (C-3^k)/4^k=0.923301 (checked 497420 configs)

Analyzing k=23 (n1_max=9, critical_n1=9)
  n1=1: min_C=5.268241e+13, C/4^k=0.748662, (C-3^k)/4^k=0.747324 (checked 23 configs)
  n1=2: min_C=4.828437e+13, C/4^k=0.686162, (C-3^k)/4^k=0.684824 (checked 253 configs)
  n1=3: min_C=4.938388e+13, C/4^k=0.701787, (C-3^k)/4^k=0.700449 (checked 1771 configs)
  n1=4: min_C=5.240754e+13, C/4^k=0.744756, (C-3^k)/4^k=0.743418 (checked 8855 configs)
  n1=5: min_C=5.577479e+13, C/4^k=0.792607, (C-3^k)/4^k=0.791270 (checked 33649 configs)
  n1=8: min_C=6.350466e+13, C/4^k=0.902455, (C-3^k)/4^k=0.901118 (checked 490314 configs)
  n1=9: min_C=6.512842e+13, C/4^k=0.925531, (C-3^k)/4^k=0.924193 (checked 817190 configs)
    Critical analysis: d=4.330296e+10, C/d=1.504018e+03
  n1=9: min_C=6.512842e+13, C/4^k=0.925531, (C-3^k)/4^k=0.924193 (checked 817190 configs)

Analyzing k=24 (n1_max=9, critical_n1=9)
  n1=1: min_C=2.108238e+14, C/4^k=0.748997, (C-3^k)/4^k=0.747993 (checked 24 configs)
  n1=2: min_C=1.932316e+14, C/4^k=0.686497, (C-3^k)/4^k=0.685493 (checked 276 configs)
  n1=3: min_C=1.976297e+14, C/4^k=0.702122, (C-3^k)/4^k=0.701118 (checked 2024 configs)
  n1=4: min_C=2.097243e+14, C/4^k=0.745090, (C-3^k)/4^k=0.744087 (checked 10626 configs)
  n1=5: min_C=2.231933e+14, C/4^k=0.792942, (C-3^k)/4^k=0.791939 (checked 42504 configs)
  n1=8: min_C=2.541128e+14, C/4^k=0.902790, (C-3^k)/4^k=0.901787 (checked 735471 configs)
  n1=9: min_C=2.606078e+14, C/4^k=0.925865, (C-3^k)/4^k=0.924862 (checked 1307504 configs)
    Critical analysis: d=2.673562e+11, C/d=9.747587e+02
  n1=9: min_C=2.606078e+14, C/4^k=0.925865, (C-3^k)/4^k=0.924862 (checked 1307504 configs)

Analyzing k=25 (n1_max=10, critical_n1=10)
  n1=1: min_C=8.435776e+14, C/4^k=0.749247, (C-3^k)/4^k=0.748495 (checked 25 configs)
  n1=2: min_C=7.732089e+14, C/4^k=0.686747, (C-3^k)/4^k=0.685995 (checked 300 configs)
  n1=3: min_C=7.908011e+14, C/4^k=0.702372, (C-3^k)/4^k=0.701620 (checked 2300 configs)
  n1=4: min_C=8.391796e+14, C/4^k=0.745341, (C-3^k)/4^k=0.744589 (checked 12650 configs)
  n1=5: min_C=8.930557e+14, C/4^k=0.793193, (C-3^k)/4^k=0.792440 (checked 53130 configs)
  n1=9: min_C=1.042714e+15, C/4^k=0.926116, (C-3^k)/4^k=0.925363 (checked 2042975 configs)
  n1=10: min_C=1.062749e+15, C/4^k=0.943911, (C-3^k)/4^k=0.943158 (checked 3268760 configs)
    Critical analysis: d=2.522855e+11, C/d=4.212485e+03
  n1=10: min_C=1.062749e+15, C/4^k=0.943911, (C-3^k)/4^k=0.943158 (checked 3268760 configs)

=== SUMMARY TABLE ===
k	n1_min	C_min/4^k	(C_min-3^k)/4^k	Critical_n1	C/d_critical	Extr_Positions
------------------------------------------------------------------------------------
3	1	0.328125	-0.093750	1		4.200e+00	{3}
4	1	0.433594	0.117188	1		2.362e+00	{4}
5	2	0.450195	0.212891	2		3.545e+01	{4,5}
6	2	0.509521	0.331543	2		7.074e+00	{5,6}
7	2	0.554016	0.420532	2		4.755e+00	{6,7}
8	2	0.587387	0.487274	3		2.423e+01	{7,8}
9	2	0.612415	0.537331	3		1.258e+01	{8,9}
10	2	0.631186	0.574873	4		1.115e+02	{9,10}
11	2	0.645265	0.603030	4		3.473e+01	{10,11}
12	2	0.655824	0.624147	4		2.318e+01	{11,12}
13	2	0.663743	0.639985	5		1.028e+02	{12,13}
14	2	0.669682	0.651864	5		5.778e+01	{13,14}
15	2	0.674137	0.660773	6		3.644e+02	{14,15}
16	2	0.677477	0.667455	6		1.477e+02	{15,16}
17	2	0.679983	0.672466	7		2.930e+03	{16,17}
18	2	0.681862	0.676225	7		3.994e+02	{17,18}
19	2	0.683272	0.679043	7		2.427e+02	{18,19}
20	2	0.684329	0.681158	8		1.225e+03	{19,20}
21	2	0.685122	0.682743	8		5.899e+02	{20,21}
22	2	0.685716	0.683932	9		5.460e+03	{21,22}
23	2	0.686162	0.684824	9		1.504e+03	{22,23}
24	2	0.686497	0.685493	9		9.748e+02	{23,24}
25	2	0.686747	0.685995	10		4.212e+03	{24,25}

=== ANALYSIS OF C/4^k RATIOS ===
Minimum C/4^k ratio found: 0.32812500

Trend analysis of C/4^k:
k=3 to k=4: change = +0.10546875
k=4 to k=5: change = +0.01660156
k=5 to k=6: change = +0.05932617
k=6 to k=7: change = +0.04449463
k=7 to k=8: change = +0.03337097
k=8 to k=9: change = +0.02502823
k=9 to k=10: change = +0.01877117
k=10 to k=11: change = +0.01407838
k=11 to k=12: change = +0.01055878
k=12 to k=13: change = +0.00791909
k=13 to k=14: change = +0.00593932
k=14 to k=15: change = +0.00445449
k=15 to k=16: change = +0.00334087
k=16 to k=17: change = +0.00250565
k=17 to k=18: change = +0.00187924
k=18 to k=19: change = +0.00140943
k=19 to k=20: change = +0.00105707
k=20 to k=21: change = +0.00079280
k=21 to k=22: change = +0.00059460
k=22 to k=23: change = +0.00044595
k=23 to k=24: change = +0.00033446
k=24 to k=25: change = +0.00025085

=== DENOMINATOR CRISIS ANALYSIS ===
k	δ={αk}		d_approx/3^k	C/d
------------------------------------------------
3	0.245122	1.851933e-01	4.200e+00
4	0.660163	5.802613e-01	2.362e+00
5	0.075204	5.350991e-02	3.545e+01
6	0.490245	4.046831e-01	7.074e+00
7	0.905285	8.729150e-01	4.755e+00
8	0.320326	2.486128e-01	2.423e+01
9	0.735367	6.648209e-01	1.258e+01
10	0.150408	1.098831e-01	1.115e+02
11	0.565449	4.798475e-01	3.473e+01
12	0.980489	9.731345e-01	2.318e+01
13	0.395530	3.154260e-01	1.028e+02
14	0.810571	7.539053e-01	5.778e+01
15	0.225612	1.692729e-01	3.644e+02
16	0.640652	5.590340e-01	1.477e+02
17	0.055693	3.935838e-02	2.930e+03
18	0.470734	3.858143e-01	3.994e+02
19	0.885775	8.477566e-01	2.427e+02
20	0.300816	2.318406e-01	1.225e+03
21	0.715856	6.424578e-01	5.899e+02
22	0.130897	9.497435e-02	5.460e+03
23	0.545938	4.599691e-01	1.504e+03
24	0.960979	9.466299e-01	9.748e+02
25	0.376019	2.977562e-01	4.212e+03

=== KEY OBSERVATIONS ===
1. Look for minimum value of C/4^k across all k
2. Check if (C-3^k)/4^k approaches a positive constant
3. Examine C/d ratios during denominator crisis
4. Note position patterns that minimize C
